{
  "version": 3,
  "updatedAt": "2026-08-27T14:30:00Z",
  "phase": {
    "current": 3,
    "name": "Hundred-agent organisation",
    "blockedOn": [
      "PILLARS.md and NON_GOALS.md do not exist; the entire product-design division (11 agents) and G1 cannot operate",
      "Branch protection not enabled, so CODEOWNERS is documentation and G2 can be bypassed by merging around it",
      "UNITY_LICENSE secrets absent, so G3 skips and the Unity layer stays unverified",
      "Core has no combat model, so four balance and simulation agents remain dormant"
    ]
  },
  "backlog": [
    {
      "id": "WO-0002",
      "title": "Author PILLARS.md and NON_GOALS.md",
      "level": "L0",
      "status": "blocked",
      "priority": 1
    },
    {
      "id": "WO-0006",
      "title": "Generate agent definitions for the active roster and run the six-agent canary",
      "level": "L1",
      "status": "in_progress",
      "priority": 1,
      "assignedTo": "ceo-orchestrator"
    },
    {
      "id": "WO-0004",
      "title": "Add a combat model to Core so simulation can measure run length and win rate",
      "level": "L2",
      "status": "queued",
      "priority": 2,
      "blockedBy": [
        "WO-0002"
      ]
    }
  ],
  "agentStatus": [
    {
      "agent": "balance-director",
      "division": "balance-sim",
      "state": "idle"
    },
    {
      "agent": "simulation-harness-engineer",
      "division": "balance-sim",
      "state": "idle"
    },
    {
      "agent": "progression-curve-analyst",
      "division": "balance-sim",
      "state": "idle"
    },
    {
      "agent": "engineering-director",
      "division": "engineering",
      "state": "idle"
    },
    {
      "agent": "core-simulation-engineer",
      "division": "engineering",
      "state": "idle"
    },
    {
      "agent": "merge-systems-engineer",
      "division": "engineering",
      "state": "idle"
    },
    {
      "agent": "combat-systems-engineer",
      "division": "engineering",
      "state": "idle"
    },
    {
      "agent": "unity-shell-engineer",
      "division": "engineering",
      "state": "idle"
    },
    {
      "agent": "performance-engineer",
      "division": "engineering",
      "state": "idle"
    },
    {
      "agent": "build-toolchain-engineer",
      "division": "engineering",
      "state": "idle"
    },
    {
      "agent": "ceo-orchestrator",
      "division": "executive",
      "state": "working",
      "currentTaskId": "WO-0006"
    },
    {
      "agent": "infra-director",
      "division": "infrastructure",
      "state": "idle"
    },
    {
      "agent": "ci-cd-engineer",
      "division": "infrastructure",
      "state": "idle"
    },
    {
      "agent": "dependency-supply-chain-auditor",
      "division": "infrastructure",
      "state": "idle"
    },
    {
      "agent": "secrets-security-auditor",
      "division": "infrastructure",
      "state": "idle"
    },
    {
      "agent": "qa-director",
      "division": "quality",
      "state": "idle"
    },
    {
      "agent": "core-logic-test-engineer",
      "division": "quality",
      "state": "idle"
    },
    {
      "agent": "property-fuzz-engineer",
      "division": "quality",
      "state": "idle"
    },
    {
      "agent": "integration-test-engineer",
      "division": "quality",
      "state": "idle"
    },
    {
      "agent": "adversarial-red-team",
      "division": "quality",
      "state": "idle"
    },
    {
      "agent": "regression-curator",
      "division": "quality",
      "state": "idle"
    },
    {
      "agent": "test-data-curator",
      "division": "quality",
      "state": "idle"
    },
    {
      "agent": "chief-of-staff",
      "division": "studio-ops",
      "state": "idle"
    },
    {
      "agent": "work-order-author",
      "division": "studio-ops",
      "state": "idle"
    },
    {
      "agent": "escalation-manager",
      "division": "studio-ops",
      "state": "idle"
    },
    {
      "agent": "memory-curator",
      "division": "studio-ops",
      "state": "idle"
    },
    {
      "agent": "lessons-promoter",
      "division": "studio-ops",
      "state": "idle"
    },
    {
      "agent": "agent-performance-auditor",
      "division": "studio-ops",
      "state": "idle"
    },
    {
      "agent": "cost-controller",
      "division": "studio-ops",
      "state": "idle"
    },
    {
      "agent": "registry-manager",
      "division": "studio-ops",
      "state": "idle"
    }
  ],
  "openEscalations": [],
  "humanQueue": [
    "Author the game pillars and non-goals, which no agent may write and which block eleven agents",
    "Enable branch protection on main with required status check 'G2 Code Gate' and Code Owner review",
    "Add Unity CI secrets for GameCI so G3 can run",
    "Open the project in Unity once and commit the generated ProjectSettings assets"
  ],
  "blockedDependencies": [
    "balance-director -> design-director",
    "combat-systems-engineer -> combat-designer",
    "engineering-director -> design-director",
    "merge-systems-engineer -> merge-systems-designer"
  ]
}
